<?xml version="1.0" encoding="UTF-8"?>
<xs:schema xmlns:xs="http://www.w3.org/2001/XMLSchema">

  <xs:element name="library">
    <xs:complexType>
      <xs:sequence>
        <xs:element name="book" maxOccurs="unbounded">
          <xs:complexType>
            <xs:sequence>
              <xs:element name="title" type="xs:string"/>
              <xs:element name="author" type="xs:string"/>
              <xs:element name="ISBN">
                <xs:simpleType>
                  <xs:restriction base="xs:string">
                    <xs:pattern value="\d{13}"/>
                  </xs:restriction>
                </xs:simpleType>
              </xs:element>
              <xs:element name="price">
                <xs:simpleType>
                  <xs:restriction base="xs:decimal">
                    <xs:minExclusive value="0"/>
                  </xs:restriction>
                </xs:simpleType>
              </xs:element>
              <xs:element name="publisher">
                <xs:complexType>
                  <xs:sequence>
                    <xs:element name="name" type="xs:string"/>
                    <xs:element name="yearEstablished">
                      <xs:simpleType>
                        <xs:restriction base="xs:integer">
                          <xs:minInclusive value="1900"/>
                          <xs:maxInclusive value="2025"/>
                        </xs:restriction>
                      </xs:simpleType>
                    </xs:element>
                  </xs:sequence>
                </xs:complexType>
              </xs:element>
            </xs:sequence>
          </xs:complexType>
        </xs:element>
      </xs:sequence>
    </xs:complexType>
  </xs:element>

</xs:schema>
